{
  "$schema": "../orquestador/runtime/schemas/runtime-layout.schema.json",
  "schema": "hebrinex.runtime.layout",
  "schema_version": 1,
  "contract_version": "1.0.0",
  "runtime_api": "1",
  "harness_version": "0.17.2",
  "default_class": "denied",
  "roots": {
    "InstallRoot": { "authority": "trusted_launcher", "consumer_write": false },
    "ProjectRoot": { "authority": "validated_binding", "consumer_write": true },
    "InstanceRoot": { "authority": "derived_from_project", "consumer_write": true },
    "CatalogRoot": { "authority": "current_user_runtime", "consumer_write": true }
  },
  "integrity": {
    "required_files": [
      "HARNESS_VERSION",
      "SHARED_MANIFEST.yaml",
      "scripts/lib/hebri-common.psm1",
      "packaging/runtime-layout.json"
    ]
  },
  "rules": [
    { "id": "DENY-GIT", "match": "prefix", "logical_path": ".git", "class": "denied", "purpose": "external_vcs", "root": "none", "target_path": "", "read": false, "write": false, "legacy_projection": "excluded" },
    { "id": "DENY-CODEX", "match": "prefix", "logical_path": ".codex", "class": "denied", "purpose": "host_local", "root": "none", "target_path": "", "read": false, "write": false, "legacy_projection": "excluded" },
    { "id": "DENY-NODE-MODULES", "match": "prefix", "logical_path": "mcp/node_modules", "class": "denied", "purpose": "dependency_cache", "root": "none", "target_path": "", "read": false, "write": false, "legacy_projection": "excluded" },
    { "id": "DENY-PERSONAL", "match": "exact", "logical_path": "infoHebri.md", "class": "denied", "purpose": "personal_local", "root": "none", "target_path": "", "read": false, "write": false, "legacy_projection": "excluded" },
    { "id": "DENY-PERSONAL-HARNESS", "match": "exact", "logical_path": "infoHebriHarness.md", "class": "denied", "purpose": "personal_local", "root": "none", "target_path": "", "read": false, "write": false, "legacy_projection": "excluded" },
    { "id": "DENY-CLAUDE-LOCAL", "match": "exact", "logical_path": ".claude/settings.local.json", "class": "denied", "purpose": "host_local_override", "root": "none", "target_path": "", "read": false, "write": false, "legacy_projection": "excluded" },
    { "id": "DENY-GITATTRIBUTES", "match": "exact", "logical_path": ".gitattributes", "class": "denied", "purpose": "source_repository_metadata", "root": "none", "target_path": "", "read": false, "write": false, "legacy_projection": "none" },
    { "id": "DENY-SOURCE-GITIGNORE", "match": "exact", "logical_path": ".gitignore", "class": "denied", "purpose": "source_repository_metadata", "root": "none", "target_path": "", "read": false, "write": false, "legacy_projection": "none" },
    { "id": "DENY-MIXED-ORCHESTRATOR", "match": "exact", "logical_path": "orquestador", "class": "denied", "purpose": "mixed_container", "root": "none", "target_path": "", "read": false, "write": false, "legacy_projection": "none" },
    { "id": "DENY-MIXED-MEMORY", "match": "exact", "logical_path": "orquestador/memory", "class": "denied", "purpose": "mixed_container", "root": "none", "target_path": "", "read": false, "write": false, "legacy_projection": "none" },
    { "id": "DENY-MIXED-SDD", "match": "exact", "logical_path": "orquestador/sdd", "class": "denied", "purpose": "mixed_container", "root": "none", "target_path": "", "read": false, "write": false, "legacy_projection": "none" },
    { "id": "DENY-MIXED-MIGRATION", "match": "exact", "logical_path": "orquestador/migration", "class": "denied", "purpose": "mixed_container", "root": "none", "target_path": "", "read": false, "write": false, "legacy_projection": "none" },
    { "id": "DENY-MIXED-RUNTIME", "match": "exact", "logical_path": "orquestador/runtime", "class": "denied", "purpose": "mixed_container", "root": "none", "target_path": "", "read": false, "write": false, "legacy_projection": "none" },
    { "id": "DENY-BUILD-LAUNCHER", "match": "exact", "logical_path": "scripts/build-launcher.ps1", "class": "denied", "purpose": "source_build_tool", "root": "none", "target_path": "", "read": false, "write": false, "legacy_projection": "none" },
    { "id": "DENY-BUILD-BASELINES", "match": "exact", "logical_path": "scripts/build-legacy-baselines.ps1", "class": "denied", "purpose": "source_build_tool", "root": "none", "target_path": "", "read": false, "write": false, "legacy_projection": "none" },
    { "id": "DENY-BUILD-MSI", "match": "exact", "logical_path": "scripts/build-msi.ps1", "class": "denied", "purpose": "source_build_tool", "root": "none", "target_path": "", "read": false, "write": false, "legacy_projection": "none" },
    { "id": "DENY-BUILD-PAYLOAD", "match": "exact", "logical_path": "scripts/build-payload.ps1", "class": "denied", "purpose": "source_build_tool", "root": "none", "target_path": "", "read": false, "write": false, "legacy_projection": "none" },
    { "id": "DENY-VALIDATE-PACKAGING", "match": "exact", "logical_path": "scripts/validate-packaging.ps1", "class": "denied", "purpose": "source_build_validation", "root": "none", "target_path": "", "read": false, "write": false, "legacy_projection": "none" },

    { "id": "TPL-MCP-CONFIG", "match": "exact", "logical_path": ".mcp.json", "class": "template", "purpose": "host_config_seed", "root": "InstallRoot", "target_path": ".mcp.json", "read": true, "write": false, "legacy_projection": "none" },
    { "id": "TPL-INSTANCE-README", "match": "exact", "logical_path": "instance/README.md", "class": "template", "purpose": "instance_documentation_seed", "root": "InstallRoot", "target_path": "instance/README.md", "read": true, "write": false, "legacy_projection": "none" },
    { "id": "TPL-ACTIVE-SESSION", "match": "exact", "logical_path": "orquestador/runtime/active-session.template.json", "class": "template", "purpose": "runtime_seed", "root": "InstallRoot", "target_path": "orquestador/runtime/active-session.template.json", "read": true, "write": false, "legacy_projection": "none" },
    { "id": "TPL-RUNTIME", "match": "prefix", "logical_path": "orquestador/runtime/templates", "class": "template", "purpose": "runtime_seed", "root": "InstallRoot", "target_path": "orquestador/runtime/templates", "read": true, "write": false, "legacy_projection": "shared" },
    { "id": "TPL-PROGRESS", "match": "prefix", "logical_path": "orquestador/sdd/progress/templates", "class": "template", "purpose": "progress_seed", "root": "InstallRoot", "target_path": "orquestador/sdd/progress/templates", "read": true, "write": false, "legacy_projection": "shared" },
    { "id": "TPL-SPECS", "match": "prefix", "logical_path": "orquestador/sdd/specs/_template", "class": "template", "purpose": "spec_seed", "root": "InstallRoot", "target_path": "orquestador/sdd/specs/_template", "read": true, "write": false, "legacy_projection": "shared" },
    { "id": "TPL-MIGRATION-REPORT", "match": "exact", "logical_path": "orquestador/migration/reports/migration-report.template.yaml", "class": "template", "purpose": "migration_report_seed", "root": "InstallRoot", "target_path": "orquestador/migration/reports/migration-report.template.yaml", "read": true, "write": false, "legacy_projection": "none" },

    { "id": "INST-ROOT", "match": "exact", "logical_path": "instance", "class": "instance", "purpose": "instance_root", "root": "InstanceRoot", "target_path": ".", "read": true, "write": true, "legacy_projection": "none" },
    { "id": "INST-LEGACY-BINDING", "match": "exact", "logical_path": "PROJECT_BINDING.yaml", "class": "instance", "purpose": "legacy_binding", "root": "InstanceRoot", "target_path": "PROJECT_BINDING.yaml", "read": true, "write": true, "legacy_projection": "instance" },
    { "id": "INST-PROGRESS", "match": "exact", "logical_path": "PROGRESS.md", "class": "instance", "purpose": "project_progress", "root": "InstanceRoot", "target_path": "PROGRESS.md", "read": true, "write": true, "legacy_projection": "instance" },
    { "id": "INST-CONTEXT", "match": "prefix", "logical_path": "orquestador/context", "class": "instance", "purpose": "project_context", "root": "InstanceRoot", "target_path": "context", "read": true, "write": true, "legacy_projection": "instance" },
    { "id": "INST-MEMORY-REGISTRY", "match": "exact", "logical_path": "orquestador/memory/memory-registry.yaml", "class": "instance", "purpose": "memory_registry", "root": "InstanceRoot", "target_path": "memory/memory-registry.yaml", "read": true, "write": true, "legacy_projection": "instance" },
    { "id": "INST-MEMORY-LOCAL", "match": "prefix", "logical_path": "orquestador/memory/local", "class": "instance", "purpose": "session_memory", "root": "InstanceRoot", "target_path": "memory/local", "read": true, "write": true, "legacy_projection": "instance" },
    { "id": "INST-MEMORY-PROJECT", "match": "prefix", "logical_path": "orquestador/memory/project", "class": "instance", "purpose": "project_memory", "root": "InstanceRoot", "target_path": "memory/project", "read": true, "write": true, "legacy_projection": "instance" },
    { "id": "INST-MEMORY-CYCLE", "match": "prefix", "logical_path": "orquestador/memory/cycle", "class": "instance", "purpose": "cycle_memory", "root": "InstanceRoot", "target_path": "memory/cycle", "read": true, "write": true, "legacy_projection": "instance" },
    { "id": "INST-MEMORY-DAILY", "match": "prefix", "logical_path": "orquestador/memory/daily", "class": "instance", "purpose": "daily_memory", "root": "InstanceRoot", "target_path": "memory/daily", "read": true, "write": true, "legacy_projection": "instance" },
    { "id": "INST-MEMORY-COMPLETE", "match": "prefix", "logical_path": "orquestador/memory/complete", "class": "instance", "purpose": "complete_memory", "root": "InstanceRoot", "target_path": "memory/complete", "read": true, "write": true, "legacy_projection": "instance" },